<?xml version="1.0" encoding="UTF-8"?>
<!DOCTYPE ligreto PUBLIC "ligreto.dtd" "ligreto.dtd">
<ligreto>
	<data-sources>
		<data-source name="Source1" desc="1st Source">
			<driver value="org.apache.derby.jdbc.EmbeddedDriver"/>
			<uri value="jdbc:derby:db1"/>
		</data-source>
		<data-source name="Source2" desc="2nd Source">
			<driver value="org.apache.derby.jdbc.EmbeddedDriver"/>
			<uri value="jdbc:derby:db2"/>
		</data-source>
	</data-sources>
	<report name="Detailed Report" options="autoFilter, autoSize,headerStyle" locale="en_US">
		<output file="detailedreport.xlsx"/>
		<data>
			<join on="1" target="full!B2" type="full" header="true" highlight="true" result="true" layout="detailed" locale="en">
				<sql data-source="Source1">select * from join_table1</sql>
				<sql data-source="Source2">select * from join_table2</sql>
			</join>
			<join target="left!B2" on="1" type="left" header="true" highlight="false" result="true" layout="detailed" locale="en_GB">
				<sql data-source="Source1">select * from join_table1</sql>
				<sql data-source="Source2">select * from join_table2</sql>
			</join>
			<join target="right!B2" on="1" type="right" header="true" highlight="false" result="true" layout="detailed" locale="cs_CZ">
				<sql type="call" data-source="Source1">select * from join_table1</sql>
				<sql data-source="Source2">select * from join_table2</sql>
			</join>
			<join target="inner!B2" on="1" type="inner" header="true" highlight="false" result="true" layout="detailed" locale="sk">
				<sql data-source="Source1">select * from join_table1</sql>
				<sql type="call" data-source="Source2">select * from join_table2</sql>
			</join>
			<join on="1" target="inner!B20" type="full" header="true" highlight="true" result="true" layout="detailed" locale="sk_SK">
				<sql type="call" data-source="Source1">select * from join_table1</sql>
				<sql type="call" data-source="Source1">select * from join_table1</sql>
			</join>
			<join target="diffs!B2" on="1" type="full" header="true" diffs="true" result="true" layout="detailed" >
				<sql data-source="Source1">select * from join_table1</sql>
				<sql data-source="Source2">select * from join_table2</sql>
			</join>
			<join target="append!B2" on="1" type="inner" header="true" diffs="true" result="true" layout="detailed" hl-color="#20d020">
				<sql data-source="Source1">select * from join_table1</sql>
				<sql data-source="Source2">select * from join_table2</sql>
			</join>
			<join target="append!B2" on="1" type="inner" header="false" append="true" diffs="true" result="true" layout="detailed" hl-color="#2020d0">
				<sql data-source="Source1">select * from join_table1</sql>
				<sql data-source="Source2">select * from join_table2</sql>
			</join>
			<join target="multicols!A1" on="1,2,3" type="full" header="true" diffs="true" result="true" layout="detailed" hl-color="#2020d0">
				<sql data-source="Source1">select id, 'ABC' aco, cast('ABCD' as char(6)) bco, first_name, last_name, age from join_table1</sql>
				<sql data-source="Source2">select id, 'ABC' aco, 'ABCD' bco, first_name, last_name, age from join_table2</sql>
			</join>
		</data>
	</report>
</ligreto>