<?xml version="1.0" encoding="UTF-8"?>
<!DOCTYPE ligreto PUBLIC "ligreto.dtd" "ligreto.dtd">
<ligreto>
	<param name="ligreto.nullString" value="&lt;&lt;null&gt;&gt;"/>
	<param name="ligreto.missingString" value="&lt;&lt;missing&gt;&gt;"/>
	<data-sources>
		<data-source name="Source1">
			<driver value="org.apache.derby.jdbc.EmbeddedDriver"/>
			<uri value="jdbc:derby:db1"/>
		</data-source>
		<data-source name="Source2">
			<driver value="org.apache.derby.jdbc.EmbeddedDriver"/>
			<uri value="jdbc:derby:db2"/>
		</data-source>
	</data-sources>
	<report name="Stream Comparison Report" type="excel.stream" options="autoFilter, autoSize,headerStyle" locale="en_US">
		<output file="streamjoinreport.xlsx"/>
		<data>
			<join on="1" target="full!B2" type="full" header="true" highlight="true" layout="normal" locale="en" result="true">
				<sql data-source="Source1">select * from join_table1</sql>
				<sql data-source="Source2">select * from join_table2</sql>
			</join>
		</data>
	</report>
</ligreto>