<?xml version="1.0" encoding="UTF-8"?>
<!DOCTYPE ligreto PUBLIC "ligreto.dtd" "ligreto.dtd">
<ligreto>
	<param name="ligreto.collatorClass" value="oracle.i18n.text.OraCollator"/>
	<param name="ligreto.collationName" value="GENERIC_M"/>
	
	<data-sources>
		<data-source name="Source1" desc="Src1">
			<driver value="org.apache.derby.jdbc.EmbeddedDriver"/>
			<uri value="jdbc:derby:db1"/>
		</data-source>
		<data-source name="Source2" desc="Src2">
			<driver value="org.apache.derby.jdbc.EmbeddedDriver"/>
			<uri value="jdbc:derby:db2"/>
		</data-source>
	</data-sources>
	<report options="autoFilter,autoSize,headerStyle">
		<output file="sortingreport.xlsx"/>
		<data>
			<join on="1,2" target="sorting!A1" result="true" layout="interlaced" sort="internal" locale="en_US">
				<sql data-source="Source1">select * from sort_table1</sql>
				<sql data-source="Source2">select * from sort_table2</sql>
			</join>
		</data>
	</report>
</ligreto>