<?xml version="1.0" encoding="UTF-8"?>
<!DOCTYPE ligreto PUBLIC "ligreto.dtd" "ligreto.dtd">
<ligreto>
	<data-sources>
		<data-source name="Source1">
			<driver value="org.apache.derby.jdbc.EmbeddedDriver"/>
			<uri value="jdbc:derby:db1"/>
		</data-source>
		<data-source name="Source2">
			<driver value="org.apache.derby.jdbc.EmbeddedDriver"/>
			<uri value="jdbc:derby:db2"/>
		</data-source>
	</data-sources>
	<ptp>
		<transfer>
			<target data-source="Source2" table="ptp_perf_table" truncate="false" recreate="true" commitInterval="1000"/>
			<sql data-source="Source1">select * from ptp_perf_table</sql>
		</transfer>
	</ptp>
	<report type="excel.stream" options="autoSize,autoFilter,headerStyle">
		<output file="ptpperf.xlsx"/>
		<data>
			<sql target="ptpperf!A1000001" data-source="Source2">
				select * from ptp_perf_table
			</sql>
		</data>
	</report>
</ligreto>