<?xml version="1.0" encoding="UTF-8"?>
<!DOCTYPE data-sources PUBLIC "ligreto.dtd" "ligreto.dtd">
<data-sources>
	<data-source name="Source1" desc="1st Data Source">
		<driver value="org.apache.derby.jdbc.EmbeddedDriver"/>
		<uri value="jdbc:derby:testdb2"/>
		<param name="user" value="test"/>
		<param name="password" value="1234"/>
		<init>
			<sql>select * from src(0)</sql>
			<sql>select * from src(1)</sql>
			<sql>select * from src(2)</sql>
		</init>
	</data-source>
	<data-source name="Source2">
		<driver value="org.apache.derby.jdbc.EmbeddedDriver"/>
		<uri value="jdbc:derby:testdb"/>
		<param name="user" value="test"/>
		<param name="password" value="1234"/>
	</data-source>
</data-sources>
