<?xml version="1.0" encoding="UTF-8"?>
<!DOCTYPE ligreto PUBLIC "ligreto.dtd" "ligreto.dtd">
<ligreto>
	<param name="dummy" value="sysibm.sysdummy1"/>
	<data-sources>
		<data-source name="Source1">
			<driver value="org.apache.derby.jdbc.EmbeddedDriver"/>
			<uri value="jdbc:derby:db1"/>
			<init>
				<sql>This is broken SQL statement!</sql>
			</init>
		</data-source>
	</data-sources>
	<report>
		<template file="blank.xlsx"/>
		<output file="initfailure.xlsx"/>
		<data>
			<sql data-source="Source1" header="true">select 'Col1' Column1, 'Col2' Column2 from ${dummy}</sql>
		</data>
	</report>
</ligreto>